KEY,en,notes,sp,fr,de,it,pt-br
MUTATION_HEAD_704_DESC,"20% miss chance.
Your spells cost 1 less mana.",,"20% шанс промаху.
Вашi заклинання коштують на 1 ману менше.","Risques d'échec +20&nbsp;%.
Vos sorts coûtent -1&nbsp;mana.","20&nbsp;% Wahrscheinlichkeit, dass deine Angriffe verfehlen.
Deine Zauber kosten 1&nbsp;Mana weniger.","20% di probabilità di mancare il bersaglio.
I tuoi incantesimi costano 1 mana in meno.","20% de chance de errar.
Seus encantamentos custam 1 a menos de mana."
MUTATION_HEAD_706_DESC,Brace 1.,,Пара 1.,Garde +1.,Wappnen&nbsp;1.,Guardia 1,Preparação 1.
MUTATION_HEAD_900_DESC,+1 range. +1 reach.,,+1 до дальностi. +1 до досяжностi.,"Portée +1, Allonge +1.",+1 Reichweite für Nah- und Fernkampfangriffe.,+1 al raggio d'azione. +1 alla portata.,+1 de alcance. +1 de envergadura.
MUTATION_HEAD_750_DESC,+1 Thorns.,,+1 до шипiв.,Épines +1.,+1&nbsp;Dornen.,+1 Spine.,+1 de espinhos.
MUTATION_HEAD_753_DESC,You are immune to ice.,,Ви iмуннi до льоду.,Immunité à la glace.,Du bist immun gegen Eis.,Sei immune al ghiaccio.,Você é imune a gelo.
MUTATION_HEAD_759_DESC,Take an extra turn at the start of the battle.,,Отримайте додатковий хiд на початку бою.,Vous jouez 1&nbsp;tour bonus en début de combat.,Am Anfang des Kampfes erhältst du einen zusätzlichen Zug.,Effettui un turno aggiuntivo all'inizio della battaglia.,Obtenha um turno adicional no início da batalha.
//legs,,,,,,,
MUTATION_LEGS_300_DESC,+1 movement range while wet. Water does not slow movement.,,"+1 до дальностi руху, коли ви мокрi. Вода не уповiльнюê рух.","Mouillé, Portée de déplacement +1. L'eau ne ralentit plus les déplacements.","+1&nbsp;Bewegungsreichweite, während du nass bist. Wasser verlangsamt dich nicht.",+1 al raggio di movimento quando ti bagni. L'acqua non rallenta il movimento.,+1 de alcance de movimento ao se molhar. A água não diminui a velocidade do movimento.
MUTATION_LEGS_301_DESC,Your basic attack has a 5% chance to Stun.,,Ваш базовий удар маê 5% шанс оглушити.,Votre attaque de base a +5&nbsp;% de chances d'infliger Étourdissement.,"Dein Grundangriff hat eine 5%ige Wahrscheinlichkeit, Betäubung zu verursachen.",Il tuo attacco base ha un 5% di probabilità di infliggere Stordimento.,Seu ataque básico possui 5% de chance de aplicar atordoamento.
MUTATION_LEGS_302_DESC,Knockback immunity.,,Iмунiтет до вiдштовхування.,Immunité au Recul.,Immun gegen Rückstoß.,Immunità a Contraccolpo.,Imunidade contra empurrões.
MUTATION_LEGS_303_DESC,Your basic attack has a 5% chance to Immobilize.,,Ваш базовий удар маê 5% шанс знерухомити.,Votre attaque de base a +5&nbsp;% de chances d'infliger Immobilisation.,"Dein Grundangriff hat eine 5%ige Wahrscheinlichkeit, bewegungsunfähig zu machen.",Il tuo attacco base ha un 5% di probabilità di infliggere Immobilizzazione.,Seu ataque básico possui 5% de chance de imobilizar.
MUTATION_LEGS_305_DESC,+5% dodge chance.,,+5% шанс ухилення.,Chances d'esquive +5&nbsp;%.,+5&nbsp;% Ausweichchance.,+5% di probabilità di schivata.,+5% de chance de esquiva.
MUTATION_LEGS_309_DESC,Your basic attack has a 10% chance to inflict Bleed 3.,,Ваш базовий удар маê 10% шанс накласти Кровотечу 3.,Votre attaque de base a 10&nbsp;% de chances d'infliger Saignement +3.,"Dein Grundangriff hat eine 10%ige Chance, Blutung&nbsp;3 zu verursachen.",Il tuo attacco base ha un 10% di probabilità di infliggere Sanguinamento 3.,Seu ataque básico possui 10% de chance de aplicar sangramento 3.
MUTATION_LEGS_310_DESC,Your movement action is a jump.,,Ваша дiя руху — стрибок.,Votre action de déplacement devient Saut.,Deine Bewegungsaktion wird zu einem Sprung.,La tua azione di movimento è un salto.,Sua ação de movimento é um salto.
MUTATION_LEGS_312_DESC,Your basic attack has +1 Knockback.,,Ваш базовий удар маê +1 до вiдштовхування.,Votre attaque de base bénéficie de Recul +1.,Dein Grundangriff hat +1&nbsp;Rückstoß.,Il tuo attacco base ha +1 Contraccolpo.,Seu ataque básico possui +1 de empurrão.
MUTATION_LEGS_313_DESC,+1 reach.,,+1 до досяжностi.,Allonge +1.,+1 Reichweite.,+1 al raggio d'azione.,+1 de alcance.
MUTATION_LEGS_314_DESC,Your weapons have +1 Damage.,,Ваша зброя маê +1 до шкоди.,Vos armes bénéficient de Dégâts +1.,Deine Waffen verursachen +1&nbsp;Schaden.,Le tue armi hanno +1 al Danno.,Suas armas possuem +1 de dano.
MUTATION_LEGS_315_DESC,Ice immunity.,,Iмунiтет до льоду.,Immunité à la glace.,Immun gegen Eis.,Immunità al ghiaccio.,Imunidade contra gelo.
MUTATION_LEGS_317_DESC,Your basic attack inflicts Bleed 1 if it's melee.,,"Ваш базовий удар накладаê Кровотечу 1, якщо це атака в ближньому бою.","Si votre attaque de base est au corps-à-corps, elle inflige Saignement +1.","Dein Grundangriff verursacht Blutung&nbsp;1, wenn es ein Nahkampfangriff ist.",Il tuo attacco base infligge Sanguinamento 1 se è corpo a corpo.,Seu ataque básico aplica sangramento 1 se for do tipo corpo-a-corpo.
MUTATION_LEGS_319_DESC,10% chance to gain a bonus move each turn.,,10% шанс отримати додатковий рух кожного ходу.,10&nbsp;% de chances de bénéficier d'un déplacement bonus à chaque tour.,"Pro Zug besteht eine 10%ige Wahrscheinlichkeit, eine zusätzliche Bewegungsaktion zu erhalten.",10% di probabilità di ottenere un movimento bonus ogni turno.,10% de chance de obter um movimento bônus a cada turno.
MUTATION_LEGS_320_DESC,10% chance to gain a bonus attack each turn.,,10% шанс отримати додаткову атаку кожного ходу.,10&nbsp;% de chances de bénéficier d'une attaque bonus à chaque tour.,"Pro Zug besteht eine 10%ige Wahrscheinlichkeit, einen zusätzlichen Angriff zu erhalten.",10% di probabilità di ottenere un attacco bonus ogni turno.,10% de chance de obter um ataque bônus a cada turno.
MUTATION_LEGS_321_DESC,Moving through water tiles costs 0 movement.,,Перемiщення через воднi клiтинки не витрачаê рух.,Traverser des cases d'eau ne coûte aucun point de déplacement.,"Es kostet keine Bewegungspunkte, dich durch Wasser zu bewegen.",Muoverti attraverso le caselle d'acqua costa 0 movimenti.,Mover-se por espaços de água custa 0 de movimento.
MUTATION_LEGS_325_DESC,Collarless spells cost -1 mana.,,Заклинання без нашийника коштують на 1 ману менше.,Vos sorts sans collier coûtent -1&nbsp;mana.,Klassenlose Zauber kosten -1&nbsp;Mana.,Gli incantesimi Senza Collare costano -1 mana.,Encantamentos sem coleira custam -1 de mana.
MUTATION_LEGS_326_DESC,Your basic attack inflicts a random debuff.,,Ваш базовий удар накладаê випадковий дебаф.,Votre attaque de base inflige un malus aléatoire.,Dein Grundangriff verursacht eine zufällige Schwächung.,Il tuo attacco base infligge un malus casuale.,Seu ataque básico aplica um enfraquecimento aleatório.
MUTATION_LEGS_327_DESC,Gain 2 random stat ups and 1 random stat down at the end of each turn.,,Отримуйте 2 випадкових пiдвищення характеристик i 1 випадкове пониження характеристики в кiнцi кожного ходу.,Vous confère +2&nbsp;stats aléatoires et -1&nbsp;stat aléatoire à la fin de chaque tour.,Erhalte am Ende jeden Zuges einen Bonus auf 2&nbsp;zufällige Attribute und einen Malus auf 1&nbsp;zufälliges Attribut.,Alla fine di ogni turno ottieni 2 aumenti casuali delle statistiche e 1 diminuzione casuale delle statistiche.,Obtenha 2 atributos aleatórios aumentados e 1 atributo aleatório diminuído no final de cada turno.
MUTATION_LEGS_328_DESC,Equip a temporary Bottles weapon at the start of the battle.,,Оснастiть тимчасову зброю Bottles на початку бою.,Vous équipe temporairement de l'arme « Bouteilles » en début de combat.,Rüste am Anfang des Kampfes vorübergehend Flaschen als Waffe aus.,Equipaggi l'arma temporanea Bottiglie all'inizio della battaglia.,Equipe uma arma de garrafa temporária no início da batalha.
MUTATION_LEGS_329_DESC,Equip a temporary Water Bottle trinket at the start of the battle.,,Оснастiть тимчасовий талiсман Water Bottle на початку бою.,Vous équipe temporairement de la babiole « Bouteille d'eau » en début de combat.,Rüste am Anfang des Kampfes vorübergehend eine Wasserflasche als Zubehör aus.,Equipaggi un ciondolo temporaneo Bottiglia d'Acqua all'inizio della battaglia.,Equipe um acessório temporário de garrafa de água no início da batalha.
MUTATION_LEGS_330_DESC,+1 Health Regeneration,,+1 вiдновлення здоров'я,Régénération de PV +1.,+1&nbsp;Lebensregeneration.,+1 a Rigenerazione Salute.,+1 de regeneração de saúde.
MUTATION_LEGS_331_DESC,+1 movement range. Your movement action is a jump.,,+1 до дальностi руху. Ваша дiя руху — стрибок.,Portée de déplacement +1. Votre action de déplacement devient Saut.,+1&nbsp;Bewegungsreichweite. Deine Bewegungsaktion wird zu einem Sprung.,+1 al raggio di movimento. La tua azione di movimento è un salto.,+1 de alcance de movimento. Sua ação de movimento é um salto.
MUTATION_LEGS_332_DESC,50% chance to spawn a pickup on an adjacent tile when you end your turn. ,,"50% шанс заспавнити предмет на сусiднiй клiтинцi, коли ви закiнчуêте свiй хiд.",50&nbsp;% de chances de faire apparaître une ressource aléatoire sur une case adjacente à la fin de votre tour. ,"Wenn du deinen Zug beendest, besteht eine 50%ige Wahrscheinlichkeit, dass auf einem benachbarten Feld ein Gegenstand erscheint. ",Probabilità del 50% di generare un raccoglibile su una casella adiacente alla fine del turno.,50% de chance de gerar um coletável em um espaço adjacente ao finalizar seu turno.
MUTATION_LEGS_333_DESC,Your basic attack has wind element and +1 Knockback.,,Ваш базовий удар маê стихiю вiтру i +1 вiдштовхування.,Votre attaque de base devient une attaque de vent et bénéficie de Recul +1.,Dein Grundangriff wird zum Typ Wind und erhält +1&nbsp;Rückstoß.,Il tuo attacco base ha elemento vento e +1 Contraccolpo.,Seu ataque básico é do elemento vento e possui +1 de empurrão.
MUTATION_LEGS_334_DESC,Your basic attack tosses units into the air if it's melee.,,"Ваш базовий удар пiдкидаê юнiтiв у повiтря, якщо це атака в ближньому бою.","Si votre attaque de base est au corps-à-corps, elle lance les unités en l'air.","Dein Grundangriff stößt Gegner in die Luft, wenn es ein Nahkampfangriff ist.",Il tuo attacco base scaglia le unità in aria se è corpo a corpo.,Seu ataque básico lança unidades no ar se for do tipo corpo-a-corpo.
MUTATION_LEGS_335_DESC,+1 Bleed Thorns. Spawn glass when you take damage.,,"+1 до Кровотечi та Шипiв. Заспавнити скло, коли ви отримуêте шкоду.",Épines sanglantes +1. Du verre apparaît quand vous subissez des dégâts.,"+1&nbsp;Blutige Dornen. Lasse Scherben erscheinen, wenn du Schaden erleidest.",+1 Spine Insanguinate. Generi vetro quando subisci danno.,+1 de espinhos de sangramento. Gere vidro ao sofrer dano.
MUTATION_LEGS_336_DESC,Your basic attack inflicts Soul Link.,,Ваш базовий удар накладаê Зв'язок Душ.,Votre attaque de base inflige Lien spirituel.,Dein Grundangriff verursacht Seelenverbindung.,Il tuo attacco base infligge Collegamento Spirituale.,Seu ataque básico aplica conexão de alma.
MUTATION_LEGS_337_DESC,You are immune to tile effects.,,Ви iмуннi до ефектiв клiтинок.,Immunité aux effets de case.,Du bist immun gegen Feldeffekte.,Sei immune agli effetti delle caselle.,Você é imune a efeitos de espaços.
MUTATION_LEGS_339_DESC,Fly away when hit.,,Вiдлiтаêте при попаданнi.,Vous vous envolez quand vous êtes touché.,"Flieg davon, wenn du getroffen wurdest.",Voli via dopo aver subito un colpo.,Voa para longe ao sofrer golpes.
MUTATION_LEGS_340_DESC,"When you take damage, gain +1 [img:lck].",,"Коли ви отримуêте шкоду, отримуйте +1 [img:lck].",[img:lck] +1&nbsp;quand vous subissez des dégâts.,"Erhalte +1&nbsp;[img:lck], wenn du Schaden erleidest.","Quando subisci danno, ottieni +1 alla [img:lck]. ","Ao sofrer dano, obtenha +1 de [img:lck]."
MUTATION_LEGS_341_DESC,Your basic attack makes units face away from you.,,Ваш базовий удар змушуê юнiтiв стояти спиною до вас.,Votre attaque de base contraint les unités à vous tourner le dos.,"Dein Grundangriff sorgt dafür, dass Einheiten sich von dir wegdrehen.",Il tuo attacco base fa voltare le unità dalla parte opposta.,Seu ataque básico faz com que unidades fiquem de costas para você.
MUTATION_LEGS_343_DESC,Spawn a Charmed Kitten familiar when you get downed.,,"Заспавнити фамiльяра Charmed Kitten, коли вас збивають.","Quand vous êtes mis K.O., un chaton envoûté de compagnie est invoqué.","Lasse einen freundlichen Katzenbegleiter erscheinen, wenn du in Ohnmacht fällst.",Generi un famiglio Gattino Ammaliato quando vai KO.,Gere um gatinho enfeitiçado ao ficar inconsciente.
MUTATION_LEGS_900_DESC,Ignore the effects of tiles and traps.,,Iгноруйте ефекти клiтинок i пасток.,Immunité aux effets de case et aux pièges.,Ignoriere Feld- und Falleneffekte.,Ignori gli effetti di caselle e trappole.,Ignore os efeitos de espaços e armadilhas.
MUTATION_LEGS_703_DESC,Water does not slow movement.,,Вода не уповiльнюê рух.,L'eau ne ralentit plus les déplacements.,Wasser verlangsamt dich nicht.,L'acqua non rallenta il tuo movimento.,A água não diminui a velocidade do movimento.
MUTATION_LEGS_705_DESC,Trample.,,Розтоптати.,Piétinement.,Trampel.,Calpestamento.,Atropelamento.
MUTATION_LEGS_707_DESC,Permanently Slow.,,Постiйне уповiльнення.,Lenteur permanente.,Dauerhaft verlangsamt.,Rallentamento permanente.,Lentidão permanente.
MUTATION_LEGS_754_DESC,Your movement action is a jump. Your basic attack inflicts Bruise.,,Ваша дiя руху — стрибок. Ваш базовий удар накладаê Синець.,Votre action de déplacement devient Saut. Votre attaque de base inflige Contusion.,Your Bewegungsaktion is a jump. Your Grundangriff inflicts Beulen.,La tua azione di movimento è un salto. Il tuo attacco base infligge Livido.,Sua ação de movimento é um salto. Seu ataque básico aplica contusão.
MUTATION_LEGS_757_DESC,Trample.,,Топтання.,Piétinement.,Trampel.,Calpestamento.,Atropelamento.
MUTATION_LEGS_758_DESC,You have All Stats Up while wet.,,"Поки ви мокрi, усi вашi характеристики пiдвищенi.","Mouillé, vous confère Hausse de stats.","Während du nass bist, erhältst du einen Bonus auf alle Attribute.",Hai Aumento delle Statistiche quando ti bagni.,Você possui todos os atributos aumentados ao se molhar.
MUTATION_LEGS_759_DESC,You have All Stats Up while wet.,,"Поки ви мокрi, усi вашi характеристики пiдвищенi.","Mouillé, vous confère Hausse de stats.","Während du nass bist, erhältst du einen Bonus auf alle Attribute.",Hai Aumento delle Statistiche quando ti bagni.,Você possui todos os atributos aumentados ao se molhar.
MUTATION_LEGS_761_DESC,Your movement action is a jump. Your basic attack inflicts Bleed.,,Ваша дiя руху — стрибок. Ваша базова атака накладаê Кровотечу.,Votre action de déplacement devient Saut. Votre attaque de base inflige Saignement.,Deine Bewegungsaktion wird zu einem Sprung. Dein Grundangriff verursacht Blutung.,La tua azione di movimento è un salto. Il tuo attacco base infligge Sanguinamento.,Sua ação de movimento é um salto. Seu ataque básico aplica sangramento.
MUTATION_LEGS_762_DESC,Ignore the effects of tiles and traps.,,Iгноруê ефекти клiтинок i пасток.,Immunité aux effets de case et aux pièges.,Ignoriere Feld- und Falleneffekte.,Ignori gli effetti di caselle e trappole.,Ignore os efeitos de espaços e armadilhas.
MUTATION_LEGS_763_DESC,Ignore the effects of tiles and traps.,,Iгноруê ефекти клiтинок i пасток.,Immunité aux effets de case et aux pièges.,Ignoriere Feld- und Falleneffekte.,Ignori gli effetti di caselle e trappole.,Ignore os efeitos de espaços e armadilhas.
//mouth,,,,,,,
MUTATION_MOUTH_301_DESC,Gain 1 health when you deal damage.,,"Отримуêте 1 здоров'я, коли завдаêте шкоди.",PV +1&nbsp;quand vous infligez des dégâts.,"Erhalte +1&nbsp;Gesundheit, wenn du Schaden verursachst.",Ottieni 1 di salute quando infliggi danno.,Obtenha 1 de saúde ao causar dano.
MUTATION_MOUTH_302_DESC,+1 Health Regeneration,,+1 Регенерацiя здоров'я,Régénération de PV +1.,+1&nbsp;Lebensregeneration.,+1 a Rigenerazione Salute.,+1 de regeneração de saúde.
MUTATION_MOUTH_304_DESC,Your basic attack inflicts Poison.,,Ваша базова атака накладаê Отруêння.,Votre attaque de base inflige Poison.,Dein Grundangriff verursacht Gift.,Il tuo attacco base infligge Veleno.,Seu ataque básico aplica veneno.
MUTATION_MOUTH_305_DESC,+100 corpse health.,,+100 здоров'я трупа.,PV de cadavre +100.,+100&nbsp;Leichenlebenspunkte.,+100 salute del cadavere.,+100 de saúde de cadáveres.
MUTATION_MOUTH_306_DESC,10% chance to spawn a Fly when you take damage.,,"10% шанс заспавнити Муху, коли ви отримуêте шкоду.",10&nbsp;% de chances d'invoquer une mouche quand vous subissez des dégâts.,"Wenn du Schaden erleidest, besteht eine 10%ige Wahrscheinlichkeit, dass eine Fliege erscheint.",10% di probabilità di generare una Mosca quando subisci danno.,10% de chance de gerar uma mosca ao sofrer dano.
MUTATION_MOUTH_307_DESC,Your basic attack has a 1% chance to instakill.,,У вашоï базовоï атаки ê 1% шанс миттêво вбити.,Votre attaque de base a +1&nbsp;% de chances de tuer sur le coup.,"Dein Grundangriff hat eine 1%ige Wahrscheinlichkeit, dein Ziel sofort zu töten.",Il tuo attacco base ha l'1% di probabilità di uccidere all'istante.,Seu ataque básico possui 1% de chance de matar instantaneamente.
MUTATION_MOUTH_308_DESC,+1 Health Regeneration,,+1 Регенерацiя здоров'я,Régénération de PV +1.,+1&nbsp;Lebensregeneration.,+1 a Rigenerazione Salute.,+1 de regeneração de saúde.
MUTATION_MOUTH_309_DESC,Your basic attack has a 10% chance to inflict Fear.,,У вашоï базовоï атаки ê 10% шанс накласти Страх.,Votre attaque de base a +10&nbsp;% de chances d'infliger Peur.,"Dein Grundangriff hat eine 10%ige Wahrscheinlichkeit, Angst zu verursachen.",Il tuo attacco base ha un 10% di probabilità di infliggere Paura.,Seu ataque básico possui 10% de chance de aplicar medo.
MUTATION_MOUTH_311_DESC,Your basic attack inflicts Leech 1.,,Ваша базова атака накладаê Вампiризм 1.,Votre attaque de base inflige Sangsue +1.,Dein Grundangriff verursacht Blutegel&nbsp;1.,Il tuo attacco base infligge Sanguisuga 1.,Seu ataque básico aplica sanguessuga 1.
MUTATION_MOUTH_312_DESC,Your basic attack has a 10% chance to inflict Immobile if it's melee.,,"У вашоï базовоï атаки ê 10% шанс накласти Нерухомiсть, якщо це атака в ближньому бою.","Si votre attaque de base est au corps-à-corps, elle a 10&nbsp;% de chances d'infliger Immobilisation.","Dein Grundangriff hat eine 10%ige Wahrscheinlichkeit, Gegner unbeweglich zu machen, wenn es ein Nahkampfangriff ist.",Il tuo attacco base ha un 10% di probabilità di infliggere Immobilizzazione se è corpo a corpo.,Seu ataque básico possui 15% de chance de imobilizar se for do tipo corpo-a-corpo.
MUTATION_MOUTH_313_DESC,"At the end of each round, spit at an enemy .",,Наприкiнцi кожного раунду плюê в ворога.,"À la fin de chaque manche, vous crachez sur un ennemi.",Spucke am Ende jeder Runde auf einen Gegner.,"Alla fine di ogni round, sputi contro un nemico.","No final de cada turno, cuspa em um inimigo."
MUTATION_MOUTH_314_DESC,Spawn 5-10 coins when downed.,,"Заспавнити 5-10 монет, коли повалений.","K.O., 5&nbsp;à 10&nbsp;pièces apparaissent.","Lasse 5&nbsp;– 10 Münzen erscheinen, wenn du in Ohnmacht fällst.",Generi 5-10 monete quando sei KO.,Gere 5-10 moedas ao ficar inconsciente.
MUTATION_MOUTH_315_DESC,10% chance to gain a bonus attack each turn.,,10% шанс отримати бонусну атаку кожного ходу.,10&nbsp;% de chances de bénéficier d'une attaque bonus chaque tour.,"Pro Zug besteht eine 10%ige Wahrscheinlichkeit, einen zusätzlichen Angriff zu erhalten.",10% di probabilità di ottenere un attacco bonus ogni turno.,10% de chance de obter um ataque bônus a cada turno.
MUTATION_MOUTH_316_DESC,Your basic attack inflicts Bruise.,,Ваша базова атака накладаê Забiй.,Votre attaque de base inflige Contusion.,Dein Grundangriff verursacht Beulen.,Il tuo attacco base infligge Livido.,Seu ataque básico aplica contusão.
MUTATION_MOUTH_317_DESC,Spawn glass when you take damage. +1 Bleed Thorns. ,,"Заспавнюê скло, коли ви отримуêте шкоду. +1 до Кровоточивих шипiв.",Du verre apparaît quand vous subissez des dégâts. Épines sanglantes +1. ,"Lasse Scherben erscheinen, wenn du Schaden erleidest. +1&nbsp;Blutige Dornen. ",Generi vetro quando subisci danno. +1 Spine Insanguinate.,Gere vidro ao sofrer dano. +1 de espinhos de sangramento.
MUTATION_MOUTH_318_DESC,Your movement action is Dig.,,Дiя руху — Копати.,Votre action de déplacement devient Tunnel.,Deine Bewegungsaktion wird zu Graben.,La tua azione di movimento è Scavo.,Sua ação de movimento é cavar.
MUTATION_MOUTH_319_DESC,Water does not slow movement. +1 Health Regeneration while wet.,,"Вода не сповiльнюê рух. +1 до вiдновлення здоров'я, коли ви мокрi.","L'eau ne ralentit plus les déplacements. Mouillé, Régénération de PV +1.","Wasser verlangsamt dich nicht. +1&nbsp;Lebensregeneration, während du nass bist.",L'acqua non rallenta il movimento. +1 a Rigenerazione Salute quando ti bagni.,A água não diminui a velocidade do movimento. +1 de regeneração de saúde ao se molhar.
MUTATION_MOUTH_322_DESC,Your basic attack inflicts Bleed.,,Ваш базовий удар накладаê Кровотечу.,Votre attaque de base inflige Saignement.,Dein Grundangriff verursacht Blutung.,Il tuo attacco base infligge Sanguinamento.,Seu ataque básico aplica sangramento.
MUTATION_MOUTH_323_DESC,+2 Health Regeneration while wet.,,"+2 до вiдновлення здоров'я, коли ви мокрi.","Mouillé, Régénération de PV +2.","+2&nbsp;Lebensregeneration, während du nass bist.",+2 a Rigenerazione Salute quando ti bagni.,+2 de regeneração de saúde ao se molhar.
MUTATION_MOUTH_324_DESC,+1 range.,,+1 до дальностi.,Portée +1.,+1&nbsp;Reichweite.,+1 al raggio d'azione.,+1 de alcance.
MUTATION_MOUTH_326_DESC,Gain +1 Health Regeneration whenever you eat food.,,"Отримуйте +1 до вiдновлення здоров'я щоразу, коли ви ïсте ïжу.",Régénération de PV +1&nbsp;quand vous mangez.,"Erhalte +1&nbsp;Lebensregeneration, wenn du etwas isst.",Ottieni +1 a Rigenerazione Salute ogni volta che mangi cibo.,Obtenha +1 de regeneração de saúde sempre que comer um alimento.
MUTATION_MOUTH_327_DESC,You can reroll your options when you level up.,,Ви можете переролити варiанти при пiдвищеннi рiвня.,Vous pouvez tirer de nouvelles options quand vous montez de niveau.,"Du kannst deine Auswahlmöglichkeiten neu generieren, wenn du ein Level aufsteigst.",Puoi modificare le tue opzioni quando sali di livello.,Você pode recombinar suas opções ao subir de nível.
MUTATION_MOUTH_328_DESC,"Can't eat food, use consumables, or use musical abilities. +2 Health Regeneration ",,"Не можете ïсти ïжу, використовувати витратнi предмети або музичнi здiбностi. +2 до вiдновлення здоров'я",Vous ne pouvez pas manger ni utiliser des consommables ou des compétences musicales. Régénération de PV +2. ,"Kann nichts essen, keine Gebrauchsgegenstände benutzen oder musikalische Fähigkeiten einsetzen. +2&nbsp;Lebensregeneration. ","Non puoi mangiare cibo, usare consumabili o abilità musicali. +2 a Rigenerazione Salute","Não é possível comer alimentos, utilizar consumíveis ou habilidades musicais. +2 de regeneração de saúde."
MUTATION_MOUTH_900_DESC,Your basic attack has a 10% chance to inflict Fear.,,Ваш базовий удар маê 10% шанс накласти Страх.,Votre attaque de base a +10&nbsp;% de chances d'infliger Peur.,"Dein Grundangriff hat eine 10%ige Wahrscheinlichkeit, Angst zu verursachen.",Il tuo attacco base ha un 10% di probabilità di infliggere Paura.,Seu ataque básico possui 10% de chance de aplicar medo.
