KEY,en,notes,sp,fr,de,it,pt-br
MUTATION_EYES_300_DESC,Your basic attack has a 10% chance to inflict Fear.,,Ваша базова атака маê 10% шанс накласти Страх.,Votre attaque de base a +10&nbsp;% de chances d'infliger Peur.,"Dein Grundangriff hat eine 10%ige Wahrscheinlichkeit, Angst zu verursachen.",Il tuo attacco base ha un 10% di probabilità di infliggere Paura.,Seu ataque básico possui 10% de chance de aplicar medo.
MUTATION_EYES_302_DESC,+1 Thorns.,,+1 до шипiв.,Épines +1.,+1&nbsp;Dornen.,+1 Spine.,+1 de espinhos.
MUTATION_EYES_304_DESC,Take your turn later.,,Ви ходите пiзнiше.,Vous jouez votre tour plus tard.,Du bist später am Zug.,Effettui il tuo turno più tardi.,Use seu turno mais tarde.
MUTATION_EYES_306_DESC,Your basic attack has a 10% chance to inflict Confusion 3.,,Ваша базова атака маê 10% шанс накласти Сплутанiсть 3.,Votre attaque de base a 10&nbsp;% de chances d'infliger Confusion +3.,"Dein Grundangriff hat eine 10%ige Wahrscheinlichkeit, Verwirrung&nbsp;3 zu verursachen.",Il tuo attacco base ha un 10% di probabilità di infliggere Confusione 3.,Seu ataque básico possui 10% de chance de aplicar confusão 3.
MUTATION_EYES_307_DESC,Gain 1 mana when anything dies.,,"Отримуйте 1 ману щоразу, коли щось помираê.",Mana +1&nbsp;quand quoi que ce soit meurt.,"Erhalte 1&nbsp;Mana, wenn eine Einheit stirbt.",Ottieni 1 mana quando qualcosa muore.,Obtenha 1 de mana quando qualquer coisa morrer.
MUTATION_EYES_308_DESC,+5% dodge chance.,,+5% шанс ухилення.,Chances d'esquive +5&nbsp;%.,+5&nbsp;% Ausweichchance.,+5% di probabilità di schivata.,+2% de chance de esquiva.
MUTATION_EYES_309_DESC,+2 corpse health.,,+2 до здоров'я трупа.,PV de cadavre +2.,+2&nbsp;Leichenlebenspunkte.,+2 salute cadavere.,+2 de saúde de cadáveres.
MUTATION_EYES_310_DESC,+1 Health Regeneration,,+1 до вiдновлення здоров'я,Régénération de PV +1.,+1&nbsp;Lebensregeneration.,+1 Rigenerazione Salute.,+1 de regeneração de saúde.
MUTATION_EYES_311_DESC,You do not take extra damage from backstabs.,,Ви не отримуêте додатковоï шкоди вiд ударiв у спину.,Vous ne subissez plus les dégâts bonus des attaques sournoises.,Du erleidest keinen zusätzlichen Schaden von Angriffen von hinten.,Non subisci danno aggiuntivo dai colpi alle spalle.,Você não sofre dano adicional de punhaladas.
MUTATION_EYES_312_DESC,+1 Brace.,,+1 до Брейсу.,Garde +1.,+1&nbsp;Wappnen.,+1 alla Guardia.,+1 de preparação.
MUTATION_EYES_314_DESC,"When you are downed, spawn 3 Flies. +2 corpse health.",,"Коли ви нокаутованi, заспавнюються 3 мухи. +2 до здоров'я трупа.","K.O., 3&nbsp;mouches sont invoquées. PV de cadavre +2.","Lasse 3&nbsp;Fliegen erscheinen, wenn du in Ohnmacht fällst. +2&nbsp;Leichenlebenspunkte.","Quando sei a terra, generi 3 Mosche. +2 salute cadavere.","Ao ficar inconsciente, gere 3 moscas. +2 de saúde de cadáveres."
MUTATION_EYES_315_DESC,+1 Kinetic Spikes.,,+1 до кiнетичних шипiв.,Pics cinétiques +1.,+1&nbsp;Kinetiknadeln.,+1 Spuntoni Cinetici.,+1 de espinhos cinéticos.
MUTATION_EYES_316_DESC,15% chance to counter attack with Chain Lightning when you get hit.,,"15% шанс контратакувати Ланцюговою Блискавкою, коли вас вдарили.","Touché, vous avez 15&nbsp;% de chances de contre-attaquer avec Éclair en chaîne.","15%ige Wahrscheinlichkeit, einen Konter mit einem Kettenblitz auszulösen, wenn du getroffen wirst.",15% di probabilità di contrattaccare con Catena di Fulmini quando subisci un colpo.,15% de contra-atacar com eletricidade encadeada ao sofrer golpes.
MUTATION_EYES_317_DESC,Gain a random stat up at the end of each turn.,,Наприкiнцi кожного ходу отримуйте випадковий бонус до однiêï характеристики.,+1&nbsp;à une stat aléatoire à la fin de chaque tour.,Erhalte am Anfang jeden Zuges einen Bonus auf ein zufälliges Attribut.,Alla fine di ogni turno ottieni un aumento casuale di una statistica.,Obtenha um atributo aleatório aumentado no final de cada turno.
MUTATION_EYES_318_DESC,You can see hidden things. +1 Knockback damage.,,Ви бачите прихованi речi. +1 шкода вiд вiдштовхування.,Vous pouvez voir des choses cachées. Dégâts de recul +1.,Du kannst versteckte Dinge sehen. +1&nbsp;Rückstoßschaden.,Puoi vedere cose nascoste. +1 al danno da Contraccolpo.,Você pode ver coisas ocultas. +1 de dano de empurrão.
MUTATION_EYES_319_DESC,Blind. +1 Damage. +1 Thorns.,,Ослiплення. +1 до шкоди. +1 до шипiв.,Cécité. Dégâts +1. Épines +1.,Blindheit. +1&nbsp;Schaden. +1&nbsp;Dornen.,Accecamento. +1 al Danno. +1 Spine.,Cegueira. +1 de dano. +1 de espinhos.
MUTATION_EYES_324_DESC,Spawn 2 extra coins each battle.,,Заспавнюê по 2 додатковi монети в кожнiй битвi.,2&nbsp;pièces bonus apparaissent à chaque combat.,Lasse in jedem Kampf 2&nbsp;zusätzliche Münzen erscheinen.,Generi 2 monete aggiuntive in ogni battaglia.,Gera 2 moedas adicionais a cada batalha.
MUTATION_EYES_325_DESC,Thorns 1.,,Шипи 1.,Épines +1.,Dornen&nbsp;1.,Spine 1.,Espinhos 1.
MUTATION_EYES_326_DESC,Gain 2 Charge each time you cast 4 spells.,,"Отримуйте 2 Заряди щоразу, коли ви використовуêте 4 заклинання.","Chaque fois que vous lancez 4&nbsp;sorts, vous gagnez Charge +2.","Erhalte jedes Mal, wenn du 4&nbsp;Zauber wirkst, 2&nbsp;Ladung.",Ottieni 2 Carica ogni volta che lanci 4 incantesimi.,Obtenha 2 cargas toda vez que lançar 4 encantamentos.
MUTATION_EYES_328_DESC,+10% crit chance.,,+10% шанс критичного удару.,Chances de coup critique +10&nbsp;%.,+10&nbsp;% kritische Trefferchance.,+10% di probabilità di colpo critico.,+10% de chance de crítico.
MUTATION_EYES_329_DESC,Your basic attack has a 15% chance to inflict Confusion.,,Ваша базова атака маê 15% шанс спричинити Сплутанiсть.,Votre attaque de base a 15&nbsp;% de chances d'infliger Confusion.,"Dein Grundangriff hat eine 15%ige Wahrscheinlichkeit, Verwirrung zu verursachen.",Il tuo attacco base ha una probabilità del 15% di infliggere Confusione.,Seu ataque básico possui 15% de chance de aplicar confusão.
MUTATION_EYES_331_DESC,"At the start of each battle, gain a random temporary pill if your trinket slot is empty.",,"На початку кожноï битви отримуйте випадкову тимчасову пiлюлю, якщо ваш слот прикраси порожнiй.","Au début de chaque combat, vous obtenez temporairement une pilule aléatoire si votre emplacement de babiole est vide.","Wenn du kein Zubehör ausgerüstet hast, erhältst du am Anfang jeden Kampfes vorübergehend eine zufällige Pille.","All'inizio di ogni battaglia, ottieni una pillola temporanea casuale se il tuo slot per i ciondoli è vuoto.","No início de cada batalha, obtenha uma pílula temporária aleatória se seu espaço de penduricalhos estiver vazio."
MUTATION_EYES_332_DESC,Start each battle Bleeding. Gain 1 Charge each time you take damage.,,"Починайте кожну битву в станi Кровотечi. Отримуйте 1 Заряд щоразу, коли отримуêте шкоду.",Vous débutez chaque combat avec Saignement. Charge +1&nbsp;chaque fois que vous subissez des dégâts.,"Beginne jeden Kampf mit Blutung. Erhalte jedes Mal, wenn du Schaden erleidest, +1&nbsp;Ladung.",Inizi ogni battaglia con Sanguinamento. Ottieni 1 Carica ogni volta che subisci danno.,Inicie cada batalha com sangramento. Obtenha 1 carga a cada vez que sofrer dano.
MUTATION_EYES_333_DESC,Your basic attack can't miss.,,Ваша базова атака не може промахнутися.,Votre attaque de base ne peut pas échouer.,Dein Grundangriff kann nicht verfehlen.,Il tuo attacco base non può mancare il bersaglio.,Seu ataque básico não pode errar.
MUTATION_EYES_334_DESC,Blind. Spawn a Flea when you take damage. ,,"Ослiплення. Заспавнюê блоху, коли ви отримуêте шкоду.",Cécité. Une puce apparaît quand vous subissez des dégâts. ,"Blindheit. Lasse einen Floh erscheinen, wenn du Schaden erleidest. ",Accecamento. Generi una Pulce quando subisci danno.,Cegueira. Gere uma pulga ao sofrer dano.
MUTATION_EYES_335_DESC,Your basic attack has a 10% chance to Charm.,,Ваша базова атака маê 10% шанс накласти Очарування.,Votre attaque de base a 10&nbsp;% de chances d'infliger Envoûtement.,"Dein Grundangriff hat eine 10%ige Wahrscheinlichkeit, Charme zu verursachen.",Il tuo attacco base ha un 10% di probabilità di infliggere Fascino.,Seu ataque básico possui 15% de chance de aplicar feitiço.
MUTATION_EYES_336_DESC,Your basic attack is electric element and has a 5% chance to stun.,,Ваша базова атака маê електричну стихiю i 5% шанс оглушити.,Votre attaque de base est électrique et a +5&nbsp;% de chances d'infliger Étourdissement.,"Dein Grundangriff ist elektrisch und hat eine 5%ige Wahrscheinlichkeit, Betäubung zu verursachen.",Il tuo attacco base è di elemento elettrico e ha un 5% di probabilità di infliggere Stordimento.,Seu ataque básico é do elemento elétrico e possui 5% de chance de aplicar atordoamento.
MUTATION_EYES_337_DESC,Your basic attack is ice element and inflicts Slow.,,Ваша базова атака маê льодову стихiю i накладаê Уповiльнення.,Votre attaque de base est de glace et inflige Lenteur.,Dein Grundangriff wird zum Typ Eis und verursacht Verlangsamung.,Il tuo attacco base è di elemento ghiaccio e infligge Rallentamento.,Seu ataque básico é do elemento gelo e aplica lentidão.
MUTATION_EYES_338_DESC,Your basic attack inflicts Burn.,,Ваша базова атака накладаê Опiк.,Votre attaque de base inflige Brûlure.,Dein Grundangriff verursacht Verbrennung.,Il tuo attacco base infligge Bruciatura.,Seu ataque básico aplica queimadura.
MUTATION_EYES_339_DESC,+1 Health Regeneration while wet. Your basic attack is water element.,,"+1 вiдновлення здоров'я, поки ви змоченi. Ваша базова атака маê водну стихiю.","Mouillé, Régénération de PV +1. Votre attaque de base devient une attaque d'eau.","+1&nbsp;Lebensregeneration, während du nass bist. Dein Grundangriff wird zum Typ Wasser.",+1 a Rigenerazione Salute quando ti bagni. Il tuo attacco base è di elemento acqua.,+1 de regeneração de saúde ao se molhar. Seu ataque básico é do elemento água.
MUTATION_EYES_340_DESC,Your basic attack inflicts Leech.,,Ваша базова атака накладаê Вампiризм.,Votre attaque de base inflige Sangsue.,Dein Grundangriff verursacht Blutegel.,Il tuo attacco base infligge Sanguisuga.,Seu ataque básico aplica sanguessuga.
MUTATION_EYES_341_DESC,Gain Charge 1 the first time you move each turn.,,"Отримуйте 1 Заряд вперше, коли ви рухаêтесь кожного ходу.",Charge +1&nbsp;la première fois que vous vous déplacez chaque tour.,"Erhalte das erste Mal, wenn du dich in einem Zug bewegst, Ladung&nbsp;1.",Ottieni Carica 1 la prima volta che ti muovi in ​​ogni turno.,Obtenha 1 carga após se mover pela primeira vez em cada turno.
MUTATION_EYES_342_DESC,Your basic attack inflicts Poison 1. Start each battle Poisoned.,,Ваш базовий удар накладаê Отруêння 1. Починаêте кожну битву отруêним.,Votre attaque de base inflige Poison +1. Vous débutez chaque combat en subissant Poison.,Dein Grundangriff verursacht Gift&nbsp;1. Beginne jeden Kampf mit Gift.,Il tuo attacco base infligge Veleno 1. Inizia ogni battaglia con Avvelenamento.,Seu ataque básico aplica veneno 1. Inicie cada batalha com envenenamento.
MUTATION_EYES_343_DESC,You have a 5% chance to inflict Fear on units who contact or attack you.,,"У вас 5% шанс накласти Страх на юнiтiв, якi торкаються або атакують вас.",5&nbsp;% de chances d'infliger Peur aux unités qui vous touchent ou vous attaquent.,"Einheiten, die dich berühren oder angreifen, erleiden mit einer 5%igen Wahrscheinlichkeit Angst.",Hai un 5% di probabilità di infliggere Paura alle unità che ti toccano o ti attaccano.,Você possui 5% de chance de aplicar medo em unidades que entrarem em contato com você ou lhe atacarem.
MUTATION_EYES_344_DESC,You have a 10% chance to Blind units who contact or attack you.,,"У вас 10% шанс ослiпити юнiтiв, якi торкаються або атакують вас.",10&nbsp;% de chances d'infliger Cécité aux unités qui vous touchent ou vous attaquent.,"Einheiten, die dich berühren oder angreifen, erleiden mit einer 10%igen Chance Blindheit.",Hai un 10% di probabilità di infliggere Accecamento alle unità che ti toccano o ti attaccano.,Você possui 5% de chance de aplicar cegueira em unidades que entrarem em contato com você ou lhe atacarem.
MUTATION_EYES_345_DESC,Inflict a random debuff on units who contact you.,,"Накладаêте випадковий дебафф на юнiтiв, якi торкаються вас.",Inflige un malus aléatoire aux unités qui vous touchent.,"Einheiten, die dich berühren oder angreifen, erleiden eine zufällige Schwächung.",Infliggi un malus casuale alle unità che ti toccano.,Aplique um enfraquecimento aleatório em unidades que entrarem em contato com você.
MUTATION_EYES_346_DESC,Spawn a rock when damaged. ,,"Заспавнюê камiнь, коли ви отримуêте шкоду.","Quand vous subissez des dégâts, un caillou apparaît. ","Lasse einen Stein erscheinen, wenn du Schaden erleidest. ",Generi una roccia quando subisci danno.,Gere uma pedra ao sofrer dano.
MUTATION_EYES_347_DESC,Your basic attack has a 15% chance to inflict Confusion 2.,,Ваш базовий удар маê 15% шанс накласти Сплутанiсть 2.,Votre attaque de base a 15&nbsp;% de chances d'infliger Confusion +2.,"Dein Grundangriff hat eine 15%ige Wahrscheinlichkeit, Verwirrung&nbsp;2 zu verursachen.",Il tuo attacco base ha un 15% di probabilità di infliggere Confusione 2.,Seu ataque básico possui 15% de chance de aplicar confusão 2.
MUTATION_EYES_348_DESC,"+1 range, +1 reach.",,"+1 до дальностi, +1 до досяжностi.","Portée +1, Allonge +1.",+1 Reichweite für Nah- und Fernkampfangriffe.,"+1 al raggio d'azione, +1 alla portata.",+1 de alcance. +1 de envergadura.
MUTATION_EYES_349_DESC,Emit 4 Sparkles each time you cast 8 spells.,,"Випускаê 4 iскри щоразу, коли ви кастуêте 8 заклять.","Chaque fois que vous lancez 8&nbsp;sorts, vous émettez 4&nbsp;étincelles.","Versprühe jedes Mal, wenn du 8&nbsp;Zauber wirkst, 4&nbsp;Funken.",Emetti 4 Scintille ogni volta che lanci 8 incantesimi.,Emite 4 fagulhas a cada vez que você lança 8 encantamentos.
MUTATION_EYES_351_DESC,Your bonus ability is a different random spell each battle.,,Ваша бонусна здiбнiсть — рiзне випадкове заклинання в кожнiй битвi.,Votre compétence bonus est un sort aléatoire différent à chaque combat.,Deine Bonusfähigkeit ist in jedem Kampf ein anderer zufälliger Zauber.,La tua abilità bonus è un incantesimo casuale diverso in ogni battaglia.,Sua habilidade bônus é um encantamento aleatório diferente a cada batalha.
MUTATION_EYES_352_DESC,You have All Stats Up while Bleeding.,,"У вас пiдвищенi всi характеристики, коли ви кровоточите.",Vous bénéficiez de Hausse de stats quand vous subissez Saignement.,"Während du blutest, hast du einen Bonus auf alle Attribute.",Hai Aumento delle Statistiche mentre subisci Sanguinamento.,Você obtém todos os atributos aumentados enquanto estiver sofrendo sangramento.
MUTATION_EYES_353_DESC,You take no extra damage from backstabs.,,Ви не отримуêте додатковоï шкоди вiд ударiв у спину.,Vous ne subissez pas les dégâts bonus des attaques sournoises.,Du erleidest keinen zusätzlichen Schaden von Angriffen von hinten.,Non subisci danno aggiuntivo dai colpi alle spalle.,Você não sofre dano adicional de punhaladas.
MUTATION_EYES_442_DESC,10% chance to reflect projectiles.,,10% шанс вiдбити проêктилi.,Chances de renvoyer les projectiles +10&nbsp;%.,"10%ige Wahrscheinlichkeit, Geschosse zu reflektieren.",10% di probabilità di riflettere i proiettili.,10% de chance de refletir projéteis.
MUTATION_EYES_900_DESC,Your basic attack has a 10% chance to inflict Slow.,,Ваш базовий удар маê 10% шанс накласти Уповiльнення.,Votre attaque de base a 10&nbsp;% de chances d'infliger Lenteur.,"Dein Grundangriff hat eine 10%ige Wahrscheinlichkeit, Verlangsamung zu verursachen.",Il tuo attacco base ha un 10% di probabilità di infliggere Rallentamento.,Seu ataque básico possui 15% de chance de aplicar lentidão.
MUTATION_EYES_M2_DESC,Blind.,,Ослiплення.,Cécité.,Blindheit.,Accecamento.,Cegueira.
MUTATION_EYES_704_DESC,10% miss chance.,,10% шанс промаху.,Risques d'échec +10&nbsp;%.,"10%ige Wahrscheinlichkeit, dass Angriffe verfehlen.",10% di probabilità di mancare il bersaglio.,10% de chance de errar.
MUTATION_EYES_705_DESC,Gain 5% miss chance every turn.,,Кожного ходу отримуêте +5% шанс промаху.,Risques d'échec +5&nbsp;% chaque tour.,"Erhalte mit jedem Zug 5&nbsp;% Wahrscheinlichkeit, dass Angriffe verfehlen.",Ottieni un 5% di probabilità di mancare il bersaglio ogni turno.,Obtenha 5% de chance de errar a cada turno.
MUTATION_EYES_706_DESC,Start each battle with Confusion 2.,,Починаêте кожну битву зi Сплутанiстю 2.,Vous débutez chaque combat avec Confusion +2.,Beginne jeden Kampf mit Verwirrung&nbsp;2.,Inizi ogni battaglia con Confusione 2.,Inicie cada batalha com confusão 2.
MUTATION_EYES_1029_DESC,+5% crit chance.,,+5% шанс критичного удару.,Chances de coup critique +5&nbsp;%.,+5&nbsp;% kritische Trefferchance.,+5% di probabilità di colpo critico.,+5% de chance de crítico.
MUTATION_EYES_313_DESC,Your basic attack creates water tiles.,,Ваш базовий удар створюê водянi клiтинки.,Votre attaque de base crée des cases d'eau.,Dein Grundangriff erschafft Wasserfelder.,Il tuo attacco base crea caselle d'acqua.,Seu ataque básico cria espaços de água.
MUTATION_EYES_754_DESC,+1 range. Your basic attack is gravity element.,,+1 до дальностi. Ваш базовий удар — гравiтацiйний елемент.,Portée +1. Votre attaque de base devient une attaque de gravité.,+1&nbsp;Reichweite. Dein Grundangriff wird zum Typ Gravitation.,+1 al raggio d'azione. Il tuo attacco base è l'elemento gravità.,+1 de alcance. Seu ataque básico é do elemento gravidade.
MUTATION_EYES_755_DESC,Your basic attack has a 15% chance to inflict Fear.,,Ваша базова атака маê 15% шанс спричинити Страх.,Votre attaque de base a +15&nbsp;% de chances d'infliger Peur.,"Dein Grundangriff hat eine 15%ige Wahrscheinlichkeit, Angst zu verursachen.",Il tuo attacco base ha un 15% di probabilità di infliggere Paura.,Seu ataque básico possui 15% de chance de aplicar medo.
//head,,,,,,,
MUTATION_HEAD_303_DESC,+1 Thorns.,,+1 до шипiв.,Épines +1.,+1&nbsp;Dornen.,+1 Spine.,+1 de espinhos.
MUTATION_HEAD_304_DESC,+2 Health Regeneration +5% dodge chance.,,+2 до регенерацiï здоров'я +5% шанс ухилення.,Régénération de PV +2. Chances d'esquive +5&nbsp;%.,+2&nbsp;Lebensregeneration +5&nbsp;% Ausweichchance.,+2 Rigenerazione Salute. +5% di probabilità di schivata.,+2 de regeneração de saúde. +5% de chance de esquiva.
MUTATION_HEAD_307_DESC,Units that contact you get knocked back 1 tile.,,"Юнiти, що контактують з вами, вiдкидаються на 1 клiтинку.",Les unités qui vous touchent subissent Recul +1.,"Einheiten, die dich berühren, werden 1&nbsp;Feld zurückgestoßen.",Le unità che ti toccano vengono respinte di 1 casella.,Unidades que entrarem em contato com você são empurradas 1 espaço para trás.
MUTATION_HEAD_308_DESC,+1 movement range while wet. Water does not slow movement.,,"+1 до радiусу ходу, коли мокрий. Вода не сповiльнюê рух.","Mouillé, Portée de déplacement +1. L'eau ne ralentit plus les déplacements.","+1&nbsp;Bewegungsreichweite, während du nass bist. Wasser verlangsamt dich nicht.",1 al raggio di movimento quando ti bagni. L'acqua non rallenta il tuo movimento.,+1 de alcance de movimento ao se molhar. A água não diminui a velocidade do movimento.
MUTATION_HEAD_311_DESC,Spawn a coin when you take damage.,,"Заспавнити монету, коли отримуêш шкоду.","Quand vous subissez des dégâts, une pièce apparaît.","Lasse eine Münze erscheinen, wenn du Schaden erleidest.",Generi una moneta quando subisci danno.,Gere uma moeda ao sofrer dano.
MUTATION_HEAD_312_DESC,Your basic attack pulls units towards you.,,Ваш базовий удар притягуê юнiтiв до вас.,Votre attaque de base attire les unités vers vous.,Dein Grundangriff zieht Einheiten an dich heran.,Il tuo attacco base attira le unità verso di te.,Seu ataque básico puxa unidades na sua direção.
MUTATION_HEAD_313_DESC,Poop when you take damage.,,"Викидаêш гiвно, коли отримуêш шкоду.",Vous chiez quand vous subissez des dégâts.,"Lege ein Häufchen, wenn du Schaden erleidest.",Fai la cacca quando subisci danno.,Faça cocô ao sofrer dano.
MUTATION_HEAD_314_DESC,Gain +1 [img:int] at the end of each turn.,,Отримуйте +1 [img:int] у кiнцi кожного ходу.,[img:int] +1&nbsp;à la fin de chaque tour.,Erhalte am Ende jeden Zuges +1&nbsp;[img:int].,Ottieni +1 all'[img:int] alla fine di ogni turno.,Obtenha +1 de [img:int] no final de cada turno.
MUTATION_HEAD_315_DESC,"At the start of each battle, swap your highest and lowest stats.",,На початку кожноï битви помiняйте мiсцями своï найвищi та найнижчi характеристики.,"À la fin de chaque combat, vos stats les plus hautes et les plus basses sont interverties.",Tausche am Anfang jeden Kampfes dein höchstes mit deinem niedrigsten Attribut.,"All'inizio di ogni battaglia, scambi la tua statistica più alta con la più bassa.","No início de cada batalha, inverta seu maior atributo com o menor."
MUTATION_HEAD_316_DESC,"When you take damage from an attack, gain a random buff.",,"Коли ви отримуêте шкоду вiд атаки, отримуêте випадкове пiдсилення.","Quand vous subissez les dégâts d'une attaque, vous bénéficiez d'un bonus aléatoire.","Erhalte eine zufällige Stärkung, wenn du Schaden von einem Angriff erleidest.","Quando subisci danni da un attacco, ottieni un bonus casuale.","Ao sofrer dano de um ataque, obtenha um fortalecimento aleatório."
MUTATION_HEAD_317_DESC,+5% dodge chance.,,+5% до шансу ухилення.,Chances d'esquive +5&nbsp;%.,+5&nbsp;% Ausweichchance.,+5% di probabilità di schivata.,+5% de chance de esquiva.
MUTATION_HEAD_318_DESC,+1 range.,,+1 до дальностi.,Portée +1.,+1&nbsp;Reichweite.,+1 al raggio d'azione.,+1 de alcance.
MUTATION_HEAD_319_DESC,Gain +1 [img:int] permanently at the end of each battle. Start each battle with Bruise 2.,,У кiнцi кожноï битви отримуйте +1 [img:int] назавжди. Починайте кожну битву з Bruise 2.,[img:int] +1&nbsp;de façon permanente à la fin de chaque combat. Vous débutez chaque combat avec Contusion +2.,Erhalte am Anfang jeden Kampfes dauerhaft +1&nbsp;[img:int]. Beginne jeden Kampf mit Beulen&nbsp;2.,Ottieni +1 all'[img:int] permanentemente alla fine di ogni battaglia. Inizi ogni battaglia con Livido 2.,Obtenha +1 de [img:int] permanentemente no início de cada batalha. Inicie cada batalha com contusão 2.
MUTATION_HEAD_320_DESC,Your basic attack has +2 Knockback.,,Ваша базова атака маê +2 до вiдштовхування.,Votre attaque de base bénéficie de Recul +2.,Dein Grundangriff hat +2&nbsp;Rückstoß.,Il tuo attacco base ha +2 Contraccolpo.,Seu ataque básico possui +2 de empurrão.
MUTATION_HEAD_321_DESC,You have a 5% chance to inflict Fear on units who contact or attack you.,,"У вас ê 5% шанс накласти Страх на юнiтiв, якi контактують з вами або атакують вас.",5&nbsp;% de chances d'infliger Peur aux unités qui vous touchent ou vous attaquent.,"Einheiten, die dich berühren oder angreifen, erleiden mit einer 5%igen Wahrscheinlichkeit Angst.",Hai un 5% di probabilità di infliggere Paura alle unità che ti toccano o ti attaccano.,Você possui 5% de chance de aplicar medo em unidades que entrarem em contato com você ou lhe atacarem.
MUTATION_HEAD_703_DESC,Attacks against your face count as backstabs.,,Атаки по вашому обличчю зараховуються як удари в спину.,Les attaques dont vous êtes la cible prennent la forme d'attaques sournoises.,Angriffe von vorn gegen dich zählen als Angriffe von hinten.,Gli attacchi contro il tuo volto contano come colpi alle spalle.,Ataques realizados de frente para você contam como punhaladas.
