KEY,en,notes,sp,fr,de,it,pt-br
MUTATION_MOUTH_1500_DESC,Your basic attack inflicts Poison.,,Ваш базовий удар накладаê Отруêння.,Votre attaque de base inflige Poison.,Dein Grundangriff verursacht Gift.,Il tuo attacco base infligge Veleno.,Seu ataque básico aplica veneno.
MUTATION_MOUTH_1026_DESC,Your basic attack has a 10% chance to inflict Webbed.,,Ваш базовий удар маê 10% шанс накласти Оплутування.,Votre attaque de base a 10&nbsp;% de chances d'infliger Toile.,"Dein Grundangriff hat eine 10%ige Chance, Netz zu verursachen.",Il tuo attacco base ha un 10% di probabilità di infliggere Ragnatela.,Seu ataque básico possui uma chance de 10% de aplicar teia.
MUTATION_MOUTH_M2_DESC,"Can't eat food, use consumables, or use musical abilities.",,"Не можете ïсти ïжу, використовувати витратнi предмети або музичнi здiбностi.",Vous ne pouvez pas manger ni utiliser des consommables ou des compétences musicales.,"Kann nichts essen, keine Gebrauchsgegenstände benutzen oder musikalische Fähigkeiten einsetzen.","Non puoi mangiare cibo, usare consumabili o abilità musicali.","Não é possível comer alimentos, utilizar consumíveis ou habilidades musicais."
MUTATION_MOUTH_705_DESC,Your basic attack can be used two extra times each turn but is replaced with a 1-damage spit attack.,,"Ваш базовий удар можна використати двiчi додатково кожного ходу, але вiн замiнений плювком, що завдаê 1 шкоди.","Votre attaque de base peut être utilisée +2&nbsp;fois à chaque tour, mais elle est remplacée par un crachat infligeant 1&nbsp;dégât.","Dein Grundangriff kann in jedem Zug zwei zusätzliche Male eingesetzt werden, wird jedoch mit einem Spuckangriff ersetzt, der 1&nbsp;Schaden verursacht.","Il tuo attacco base può essere usato due volte aggiuntive per turno, ma viene sostituito da un attacco con sputo da 1 danno.","Seu ataque básico pode ser utilizado 2 vezes adicionais a cada turno, mas é substituído por um ataque de cuspe que causa 1 de dano."
MUTATION_MOUTH_750_DESC,Your basic attack destroys inanimate objects and turns tiles into dirt.,,Ваш базовий удар руйнуê неживi об'êкти та перетворюê клiтинки на ґрунт.,Votre attaque de base détruit les objets inanimés et change les cases en terre.,Dein Grundangriff zerstört nicht lebendige Objekte und verwandelt Felder in Dreck.,Il tuo attacco base distrugge oggetti inanimati e trasforma le caselle in terra.,Seu ataque básico destrói objetos inanimados e transforma espaços em terra.
MUTATION_MOUTH_752_DESC,Your basic attack creates water tiles.,,Ваш базовий удар створюê водянi клiтинки.,Votre attaque de base crée des cases d'eau.,Dein Grundangriff erschafft Wasserfelder.,Il tuo attacco base crea caselle d'acqua.,Seu ataque básico cria espaços de água.
MUTATION_MOUTH_754_DESC,Adjacent units get All Stats Down.,,Сусiднi юнiти отримують Зниження всiх характеристик.,Les unités adjacentes subissent Baisse de stats.,Benachbarte Einheiten erhalten einen Malus auf alle Attribute.,Le unità adiacenti ottengono Diminuzione delle Statistiche.,Unidades adjacentes têm todos os atributos diminuídos.
MUTATION_MOUTH_755_DESC,Ice Immunity.,,Iмунiтет до льоду.,Immunité à la glace.,Immun gegen Eis.,Immunità al ghiaccio.,Imunidade contra gelo.
MUTATION_MOUTH_757_DESC,Your basic attack inflicts Bleed.,,Ваш базовий удар накладаê Кровотечу.,Votre attaque de base inflige Saignement.,Dein Grundangriff verursacht Blutung.,Il tuo attacco base infligge Sanguinamento.,Seu ataque básico aplica sangramento.
MUTATION_MOUTH_760_DESC,"When a food pickup spawns within 2 tiles of you, move to it.",,"Коли предмет ïжi заспавнюêться в межах 2 клiтинок вiд вас, перемiстiться до нього.","Quand de la nourriture apparaît dans un rayon de 2&nbsp;cases autour de vous, vous vous déplacez vers elle.","Wenn ein Essensgegenstand innerhalb von 2&nbsp;Feldern von dir erscheint, bewegst du dich zu ihm.","Quando un raccoglibile Cibo appare entro 2 caselle da te, ti muovi verso di esso.","Quando um coletável de comida for gerado dentro de até 2 espaços de distância de você, mova-se até ele."
//tail,,,,,,,
MUTATION_TAIL_301_DESC,Poop when you take damage.,,"Видiляêте гiвно, коли отримуêте шкоду.",Vous chiez quand vous subissez des dégâts.,"Lege ein Häufchen, wenn du Schaden erleidest.",Fai la cacca quando subisci danno.,Faça cocô ao sofrer dano.
MUTATION_TAIL_302_DESC,Your basic attack inflicts Poison.,,Ваша базова атака накладаê отруту.,Votre attaque de base inflige Poison.,Dein Grundangriff verursacht Gift.,Il tuo attacco base infligge Veleno.,Seu ataque básico aplica veneno.
MUTATION_TAIL_303_DESC,Your basic attack has a 5% chance to Stun.,,Ваша базова атака маê 5% шанс приголомшити.,Votre attaque de base a +5&nbsp;% de chances d'infliger Étourdissement.,"Dein Grundangriff hat eine 5%ige Wahrscheinlichkeit, Betäubung zu verursachen.",Il tuo attacco base ha un 5% di probabilità di infliggere Stordimento.,Seu ataque básico possui 5% de chance de aplicar atordoamento.
MUTATION_TAIL_305_DESC,+1 Thorns.,,+1 до Шипiв.,Épines +1.,+1&nbsp;Dornen.,+1 Spine.,+1 de espinhos.
MUTATION_TAIL_308_DESC,+5% dodge chance.,,+5% шанс ухилення.,Chances d'esquive +5&nbsp;%.,+5&nbsp;% Ausweichchance.,+5% di probabilità di schivata.,+5% de chance de esquiva.
MUTATION_TAIL_310_DESC,Your basic attack has a 10% chance to repeat once.,,Ваша базова атака маê 10% шанс повторитися ще раз.,Votre attaque de base a 10&nbsp;% de chances de se répéter.,Dein Grundangriff wiederholt sich mit einer Wahrscheinlichkeit von 10&nbsp;%.,Il tuo attacco base ha un 10% di probabilità di ripetersi una volta.,Seu ataque básico possui 10% de se repetir uma vez.
MUTATION_TAIL_311_DESC,Thorns 1.,,Шипи 1.,Épines +1.,Dornen&nbsp;1.,Spine 1.,Espinhos 1.
MUTATION_TAIL_313_DESC,Your basic attack creates water tiles.,,Ваша базова атака створюê водянi клiтинки.,Votre attaque de base crée des cases d'eau.,Dein Grundangriff erschafft Wasserfelder.,Il tuo attacco base crea caselle d'acqua.,Seu ataque básico cria espaços de água.
MUTATION_TAIL_314_DESC,"Whenever you down a unit, you have a 10% chance to reanimate that unit with 50% HP.",,"Коли ви добиваêте юнiта, ê 10% шанс реанiмувати його з 50% HP.","Quand vous tuez une unité, vous avez 10&nbsp;% de chances de la réanimer avec 50&nbsp;% de ses PV.","Immer, wenn eine Einheit durch dich in Ohnmacht fällt, besteht eine 10%ige Wahrscheinlichkeit, dass du diese Einheit mit 50&nbsp;% LP wiederbelebst.","Ogni volta che mandi KO un'unità, hai un 10% di probabilità di rianimare quell'unità con il 50% di PS.","Sempre que deixar uma unidade inconsciente, você possui 10% de chance de reanimar essa unidade com 50% de saúde."
MUTATION_TAIL_315_DESC,20% chance to spawn a Maggot when hit.,,20% шанс заспавнити личинку при попаданнi.,20&nbsp;% de chances d'invoquer un asticot quand vous subissez une attaque.,"Wenn du getroffen wirst, besteht eine 10%ige Wahrscheinlichkeit, dass eine Fliege erscheint.",20% di probabilità di generare un Verme quando ti colpiscono.,20% de chance de gerar um verme ao sofrer golpes.
MUTATION_TAIL_316_DESC,25% chance to spawn tall grass wherever you end your movement.,,"25% шанс заспавнити високу траву там, де ви закiнчуêте рух.",25&nbsp;% de chances que des hautes herbes apparaissent quand vous finissez de vous déplacer.,"Wenn du deine Bewegungsaktion beendest, besteht eine Wahrscheinlichkeit von 25&nbsp;%, dass dort hohes Gras erscheint.",25% di probabilità di generare erba alta in qualsiasi punto termini il tuo movimento.,25% de chance de gerar grama alta sempre que finalizar seu movimento.
MUTATION_TAIL_317_DESC,"When hit, fart a Poison 4 attack with Knockback behind you.",,"Коли вас вдаряють, ви випускаêте атаку Отрута 4 з вiдштовхуванням позаду себе.","Touché, vous lâchez un pet qui inflige Poison +4&nbsp;et Recul derrière vous.","Wenn du getroffen wirst, musst du nach hinten furzen und verursachst so einen Angriff mit Gift&nbsp;4 und Rückstoß.","Quando ti colpiscono, scoreggi, effettuando un attacco Veleno 4 con Contraccolpo dietro di te.","Ao sofrer golpes, realize um ataque de pum com veneno 4 e empurrão atrás de você."
MUTATION_TAIL_318_DESC,Your basic attack inflicts Poison.,,Ваша базова атака накладаê отруту.,Votre attaque de base inflige Poison.,Dein Grundangriff verursacht Gift.,Il tuo attacco base infligge Veleno.,Seu ataque básico aplica veneno.
MUTATION_TAIL_319_DESC,Units who contact you get Poisoned.,,"Юнiти, якi контактують iз вами, стають отруêними.",Les unités qui vous touchent subissent Poison.,"Einheiten, die dich berühren, werden vergiftet.",Le unità che ti toccano subiscono Avvelenamento.,Unidades que entram em contato com você sofrem envenenamento.
MUTATION_TAIL_320_DESC,Bleed 1. Bleed Thorns 2.,,Кровотеча 1. Шипи кровотечi 2.,Saignement +1. Épines sanglantes +2.,Blutung&nbsp;1. Blutige Dornen&nbsp;2.,Sanguinamento 1. Spine Insanguinate 2.,Sangramento 1. Espinhos de sangramento 2.
MUTATION_TAIL_322_DESC,Gain +1 [img:spd] each turn.,,Отримуêте +1 [img:spd] кожного ходу.,[img:spd] +1&nbsp;chaque tour.,Erhalte jeden Zug +1&nbsp;[img:spd].,Ottieni +1 alla [img:spd] ogni turno.,Obtenha +1 de [img:spd] a cada turno.
MUTATION_TAIL_323_DESC,Your movement action is a jump.,,Ваша дiя руху — стрибок.,Votre action de déplacement devient Saut.,Deine Bewegungsaktion wird zu einem Sprung.,La tua azione di movimento è un salto.,Sua ação de movimento é um salto.
MUTATION_TAIL_325_DESC,Units that contact you get knocked back 2 tiles.,,"Юнiти, якi контактують iз вами, вiдштовхуються на 2 клiтинки.",Les unités qui vous touchent subissent Recul +2.,"Einheiten, die dich berühren, werden 2&nbsp;Felder zurückgestoßen.",Le unità che ti toccano vengono respinte all'indietro di 2 caselle.,Unidades que entram em contato com você são empurradas 2 espaços para trás.
MUTATION_TAIL_326_DESC,10% dodge chance. Bruise 1.,,10% шанс ухилення. Синяк 1.,Chances d'esquive +10&nbsp;%. Contusion +1.,10&nbsp;% Ausweichchance. Beulen&nbsp;1.,10% di probabilità di schivata. Livido 1.,10% de chance de esquiva. Contusão 1.
MUTATION_TAIL_327_DESC,"If you don't move, gain 3 Charge at the end of the turn.",,"Якщо ви не рухаêтеся, отримуêте 3 заряди в кiнцi ходу.",Charge +3&nbsp;à la fin du tour si vous ne bougez pas.,"Wenn du dich nicht bewegst, erhältst du am Ende des Zuges 3&nbsp;Ladung.","Se non ti muovi, ottieni 3 Carica alla fine del turno.","Se você não se mover, obtenha carga 3 no final do turno."
MUTATION_TAIL_329_DESC,You can unequip cursed items and parasites.,,Ви можете знiмати проклятi предмети та паразитiв.,Vous pouvez déséquiper les objets maudits et les parasites.,Du kannst verfluchte Gegenstände und Parasiten ablegen.,Puoi disequipaggiare oggetti maledetti e parassiti.,Você pode desequipar itens amaldiçoados e parasitas.
MUTATION_TAIL_331_DESC,You can reroll your options when you level up.,,При пiдвищеннi рiвня ви можете переробити варiанти.,Vous pouvez tirer de nouvelles options quand vous montez de niveau.,"Du kannst deine Auswahlmöglichkeiten neu generieren, wenn du ein Level aufsteigst.",Puoi modificare le tue opzioni quando sali di livello.,Você pode recombinar suas opções ao subir de nível.
MUTATION_TAIL_332_DESC,+25% chance to reflect projectiles.,,+25% шанс вiдбити снаряди.,Chances de renvoyer les projectiles +25&nbsp;%.,"+25&nbsp;% Wahrscheinlichkeit, Geschosse zu reflektieren.",+25% di probabilità di riflettere i proiettili.,+25% de chance de refletir projéteis.
MUTATION_TAIL_334_DESC,Your basic attack inflicts Burn 1.,,Ваш базовий удар накладаê Опiк 1.,Votre attaque de base inflige Brûlure +1.,Dein Grundangriff verursacht Verbrennung&nbsp;1.,Il tuo attacco base infligge Bruciatura 1.,Seu ataque básico aplica queimadura 1.
MUTATION_TAIL_336_DESC,+1 Thorns.,,+1 Шипи.,Épines +1.,+1&nbsp;Dornen.,+1 Spine.,+1 de espinhos.
MUTATION_TAIL_337_DESC,Your basic attack is wind element.,,Ваш базовий удар — елемент вiтру.,Votre attaque de base devient une attaque de vent.,Dein Grundangriff wird zum Typ Wind.,Il tuo attacco base è di elemento vento.,Seu ataque básico é do elemento vento.
MUTATION_TAIL_338_DESC,Your basic attack inflicts Burn 1.,,Ваш базовий удар накладаê Опiк 1.,Votre attaque de base inflige Brûlure +1.,Dein Grundangriff verursacht Verbrennung&nbsp;1.,Il tuo attacco base infligge Bruciatura 1.,Seu ataque básico aplica queimadura 1.
MUTATION_TAIL_339_DESC,"While at full mana, you have +2 Damage.",,"Поки у вас повна мана, ви маêте +2 до шкоди.",Dégâts +2&nbsp;quand vous avez tout votre mana.,"Erhalte +2&nbsp;Schaden, während dein Mana voll ist.","Finché sei a mana pieno, hai +2 al Danno.","Enquanto sua mana estiver completa, obtenha +2 de dano."
MUTATION_TAIL_341_DESC,Gain +1 Charge when you take damage.,,"Отримуêте +1 Заряд, коли отримуêте шкоду.",Charge +1&nbsp;quand vous subissez des dégâts.,"Erhalte +1&nbsp;Ladung, wenn du Schaden erleidest.",Ottieni +1 Carica quando subisci danno.,Obtenha +1 carga ao sofrer dano.
MUTATION_TAIL_342_DESC,Spawn a Charmed Kitten familiar when you get downed.,,"Коли вас виводять з ладу, заспавниться фамiльяр — Зачароване кошеня.","Quand vous êtes mis K.O., un chaton envoûté de compagnie est invoqué.","Lasse einen freundlichen Katzenbegleiter erscheinen, wenn du in Ohnmacht fällst.",Generi un famiglio Gattino Ammaliato quando vai KO.,Gere um gatinho enfeitiçado ao ficar inconsciente.
MUTATION_TAIL_703_DESC,Start each battle with Immobile 1.,,Починайте кожну битву з Нерухомiстю 1.,Vous débutez chaque combat avec Immobilisation +1.,Beginne jeden Kampf mit Unbeweglich&nbsp;1.,Inizi ogni battaglia con Immobilizzazione 1.,Inicie cada batalha com imobilidade 1.
MUTATION_TAIL_704_DESC,Hunter abilities are also offered when you level up.,,При пiдвищеннi рiвня також пропонуються здiбностi Мисливця.,Les compétences de sentinelle vous sont proposées quand vous montez de niveau.,"Wenn du ein Level aufsteigst, befinden sich unter deinen Auswahlmöglichkeiten auch Jägerfähigkeiten.",Ti vengono offerte anche le abilità del Cacciatore quando sali di livello.,Habilidades de caçador também são oferecidas ao subir de nível.
MUTATION_TAIL_751_DESC,+1 Brace.,,+1 Брейс.,Garde +1.,+1&nbsp;Wappnen.,+1 alla Guardia.,+1 de preparação.
MUTATION_TAIL_754_DESC,+1 Thorns.,,+1 Шипи.,Épines +1.,+1&nbsp;Dornen.,+1 Spine.,+1 de espinhos.
MUTATION_TAIL_755_DESC,Water does not slow movement.,,Вода не сповiльнюê рух.,L'eau ne ralentit plus les déplacements.,Wasser verlangsamt dich nicht.,L'acqua non rallenta il movimento.,A água não diminui a velocidade do movimento.
MUTATION_TAIL_756_DESC,+1 Bleed Thorns.,,+1 Кровоточивi шипи.,Épines sanglantes +1.,+1&nbsp;Blutige Dornen.,+1 Spine Insanguinate.,+1 de espinhos de sangramento.
MUTATION_TAIL_757_DESC,Your movement action is shadowstep.,,Ваша дiя руху — тiньовий крок.,Votre action de déplacement devient Pas de l'ombre.,Deine Bewegungsaktion ist Schattenschritt.,La tua azione di movimento è Passo d'Ombra.,Sua ação de movimento é um passo sombrio.
MUTATION_TAIL_759_DESC,Start with +1 Bonus Attack.,,Починайте з +1 додатковоï атаки.,Vous débutez avec Attaque bonus +1.,Beginne jeden Kampf mit +1&nbsp;Bonusangriff.,Inizi con +1 Attacco Bonus.,Inicie com +1 de bônus de ataque.
MUTATION_TAIL_760_DESC,Start with 2 backflips.,,Починайте з 2 сальто назад.,Vous débutez avec Salto arrière +2.,Beginne jeden Kampf mit 2&nbsp;Rückwärtssaltos.,Inizi con 2 Salti Mortali all'Indietro.,Inicie com 2 mortais para trás.
//texture,,,,,,,
MUTATION_TEXTURE_300_DESC,+1 Health Regeneration,,+1 Регенерацiя здоров'я,Régénération de PV +1.,+1&nbsp;Lebensregeneration.,+1 a Rigenerazione Salute.,+1 de regeneração de saúde.
MUTATION_TEXTURE_301_DESC,+1 Health and Mana Regeneration while wet.,,"+1 до вiдновлення здоров'я та мани, коли ви мокрi.","Mouillé, PV +1&nbsp;et Régénération de mana +1.","+1&nbsp;Lebens- und Manaregeneration, während du nass bist.",+1 a Rigenerazione Salute e Mana quando ti bagni.,+1 de saúde e regeneração de mana ao se molhar.
MUTATION_TEXTURE_303_DESC,Start each battle with a random stat up.,,Починайте кожну битву з випадковим пiдвищенням однiêï характеристики.,Vous débutez chaque combat avec +1&nbsp;à une stat aléatoire.,Beginne jeden Kampf mit einem Bonus auf ein zufälliges Attribut.,Inizi ogni battaglia con un aumento casuale di una statistica.,Inicie cada batalha com um atributo aleatório aumentado.
MUTATION_TEXTURE_304_DESC,Units that contact or attack you have a 10% chance to become Confused.,,"юнiти, що торкаються або атакують вас, мають 10% шанс стати сплутаними.",Les unités qui vous touchent ou vous attaquent ont 10&nbsp;% de chances de subir Confusion.,"Einheiten, die dich berühren oder angreifen, werden mit 10%iger Wahrscheinlichkeit verwirrt.",Le unità che ti toccano o ti attaccano hanno un 10% di probabilità di subire Confusione.,Unidades que entram em contato com você ou lhe atacam têm uma chance de 10% de sofrerem confusão.
MUTATION_TEXTURE_307_DESC,+5% dodge chance.,,+5% шанс ухилення.,Chances d'esquive +5&nbsp;%.,+5&nbsp;% Ausweichchance.,+5% di probabilità di schivata.,+5% de chance de esquiva.
MUTATION_TEXTURE_309_DESC,Your basic attack has a 5% chance to inflict Fear. You have a 5% chance to inflict Fear on units who contact or attack you.,,"Ваша базова атака маê 5% шанс накласти Страх. Ви маêте 5% шанс накласти Страх на юнiтiв, що торкаються або атакують вас.",Votre attaque de base a 5&nbsp;% de chances d'infliger Peur. 5&nbsp;% de chances d'infliger Peur aux unités qui vous touchent ou vous attaquent.,"Dein Grundangriff hat eine 5%ige Chance, Angst zu verursachen. Du hast eine 5%ige Chance, Angst bei Einheiten zu verursachen, die dich berühren oder angreifen.",Il tuo attacco base ha un 5% di probabilità di infliggere Paura. Hai un 5% di probabilità di infliggere Paura alle unità che ti toccano o ti attaccano.,Seu ataque básico possui 5% de chance de aplicar medo. Você possui 5% de chance de aplicar medo em unidades que entrem em contato com você ou lhe ataquem.
MUTATION_TEXTURE_310_DESC,Gain double the effects of pickups you collect.,,"Отримуйте вдвiчi бiльше ефектiв вiд предметiв, якi ви пiдбираêте.",Les effets des ressources que vous ramassez sont doublés.,"Gegenstände, die du aufhebst, haben doppelte Wirkung.",Ottieni il doppio degli effetti dai raccoglibili che prendi.,Obtenha um efeito dobrado de todos os coletáveis recolhidos.
MUTATION_TEXTURE_702_DESC,Start each battle with Bleed 1.,,Починайте кожну битву з Кровотечею 1.,Vous débutez chaque combat avec Saignement +1.,Beginne jeden Kampf mit Blutung&nbsp;1.,Inizi ogni battaglia con Sanguinamento 1.,Inicie cada batalha com sangramento 1.
MUTATION_TEXTURE_703_DESC,Mage abilities are also offered when you level up.,,Пiд час пiдвищення рiвня вам також пропонуються здiбностi мага.,Les compétences de mage vous sont proposées quand vous montez de niveau.,"Wenn du ein Level aufsteigst, befinden sich unter deinen Auswahlmöglichkeiten auch Magierfähigkeiten.",Ti vengono offerte anche le abilità del Mago quando sali di livello.,Habilidades de mago também são oferecidas ao subir de nível.
MUTATION_TEXTURE_704_DESC,Fighter abilities are also offered when you level up.,,Пiд час пiдвищення рiвня вам також пропонуються здiбностi бiйця.,Les compétences de pugiliste vous sont proposées quand vous montez de niveau.,"Wenn du ein Level aufsteigst, befinden sich unter deinen Auswahlmöglichkeiten auch Kriegerfähigkeiten.",Ti vengono offerte anche le abilità del Guerriero quando sali di livello.,Habilidades de lutador também são oferecidas ao subir de nível.
MUTATION_TEXTURE_705_DESC,Thief abilities are also offered when you level up.,,Пiд час пiдвищення рiвня вам також пропонуються здiбностi злодiя.,Les compétences de fourbe vous sont proposées quand vous montez de niveau.,"Wenn du ein Level aufsteigst, befinden sich unter deinen Auswahlmöglichkeiten auch Diebesfähigkeiten.",Ti vengono offerte anche le abilità del Ladro quando sali di livello.,Habilidades de ladrão também são oferecidas ao subir de nível.
MUTATION_TEXTURE_706_DESC,10% dodge chance.,,10% шанс ухилення.,Chances d'esquive +10&nbsp;%.,10&nbsp;% Ausweichchance.,10% di probabilità di schivata.,+10% de chance de esquiva.
MUTATION_TEXTURE_750_DESC,Units who contact you get Poison 2.,,"юнiти, що торкаються вас, отримують Отруêння 2.",Les unités qui vous touchent subissent Poison +2.,"Einheiten, die dich berühren, erleiden Gift&nbsp;2.",Le unità che ti toccano subiscono Veleno 2.,Unidades que entram em contato com você sofrem veneno 2.
